{
  "schemaVersion": "1",
  "decisionId": "policy-decision-001",
  "journeyType": "REFUND",
  "effect": "APPROVAL_REQUIRED",
  "policyVersion": "refund-policy-v1",
  "inputFactsHash": "sha256:3333333333333333333333333333333333333333333333333333333333333333",
  "factRefs": [
    {
      "factId": "order-observation-001",
      "factType": "ORDER_CONTEXT",
      "sourceVersion": "sha256:1111111111111111111111111111111111111111111111111111111111111111",
      "observedAt": "2026-07-26T15:29:30Z"
    }
  ],
  "reasonCodes": [
    "AMOUNT_EXCEEDS_AUTO_APPROVAL_THRESHOLD"
  ],
  "obligations": [
    {
      "code": "REQUIRE_HUMAN_APPROVAL",
      "parameters": {
        "approvalClass": "REFUND_HIGH_VALUE"
      }
    }
  ],
  "missingFacts": [],
  "decidedAt": "2026-07-26T15:30:05Z",
  "validUntil": "2026-07-26T15:45:05Z"
}
